keyword,city,source_file,ranking,title,link,snippet,business_name,rating,review_count,official_website,top_3_reviews,profile_updates,attributes,product_listings,domain,domain_authority,page_authority,spam_score,backlinks_count,referring_domains,pages_to_domain,top_backlinks,trust_flow
family lawyers near me,Carlsbad,FamilyLaw-HighVolume -- Carlsbad.xlsx,3,"Carlsbad Divorce Lawyers | Family Law Attorneys in Carlsbad, CA",https://www.gylfamilylawfirm.com/,Contact us for a consultation with a family law lawyer near you! Call 858-951-1526 or submit an online contact form here! Get In Touch.,,,,,,,,,gylfamilylawfirm.com,29,33,1,1992,306,6879,,
prenuptial lawyer near me,Carlsbad,FamilyLaw-HighVolume -- Carlsbad.xlsx,1,Carlsbad Prenuptial and Postnuptial Lawyers - Beringer Law Firm,https://www.beringerlaw.com/family-law/pre-post-marital-agreements/,Consult with a prenuptial and postnuptial agreement attorney in Carlsbad and San Diego County by contacting us at (760) 546-9900.,,,,,,,"{'type': None, 'hours': None, 'phone': None}",,beringerlaw.com,18,31,1,522,156,2259,,
prenuptial lawyer near me,Carlsbad,FamilyLaw-HighVolume -- Carlsbad.xlsx,3,Carlsbad Prenup Attorneys | Carlsbad Prenuptial Agreement Lawyer,https://www.gylfamilylawfirm.com/agreements/prenuptial-agreements/,Our family law specialists and the team of Carlsbad prenup lawyers know how to skillfully draft a prenuptial agreement that supports and protects your best ...,,,,,,,,,gylfamilylawfirm.com,29,33,1,1992,306,6879,,
breach of contract attorney carlsbad,Carlsbad,business law Long tail -- Carlsbad.xlsx,3,Carlsbad Civil Litigation Attorney | Partnership Dispute Lawyers,https://www.loftinbedell.com/dispute-resolution-and-litigation/,"Contact our Carlsbad, California, office at 866-933-2340 or 760-814-9649. Civil Litigation May Be Your Best Option. Sometimes, business transactions go bad.",,,,,,,,,loftinbedell.com,29,28,2,4860,264,25932,,
spousal support lawyer near me,Carlsbad,FamilyLaw-HighVolume -- Carlsbad.xlsx,1,"Carlsbad Spousal Support Lawyer | Beringer Law Firm, APC",https://www.beringerlaw.com/family-law/spousal-support/,Put your case in reliable hands by calling the Carlsbad alimony lawyers at the Beringer Law Firm. Call to schedule a FREE consultation with our skilled ...,,,,,,,"{'type': None, 'hours': None, 'phone': None}",,beringerlaw.com,18,31,1,522,156,2259,,
spousal support lawyer near me,Carlsbad,FamilyLaw-HighVolume -- Carlsbad.xlsx,2,Spousal Support Attorney in Carlsbad - McKinnon Law Firm,https://www.mckinnonfamilylaw.com/practice-areas/family-law/spousal-support/,"Numerous factors influence the determination of maintenance in a Carlsbad divorce. For personalized guidance, contact McKinnon Law Firm.",,,,,,,,,mckinnonfamilylaw.com,19,26,1,303,70,7226,,
spousal support lawyer near me,Carlsbad,FamilyLaw-HighVolume -- Carlsbad.xlsx,3,Carlsbad Alimony Lawyer - Spousal Support Attorney CA,https://www.ericabloomlaw.com/carlsbad-alimony-lawyer/,Securing your financial stability. Carlsbad Alimony Lawyer ensures fair alimony arrangements. Consult with Erica Bloom Law for personalized solutions!,,,,,,,,,ericabloomlaw.com,15,25,2,174,60,18045,,
breach of contract lawyer carlsbad,Carlsbad,business law Long tail -- Carlsbad.xlsx,1,Carlsbad Civil Litigation Attorney | Partnership Dispute Lawyers,https://www.loftinbedell.com/dispute-resolution-and-litigation/,"Contact our Carlsbad, California, office at 866-933-2340 or 760-814-9649. Civil Litigation May Be Your Best Option. Sometimes, business transactions go bad.",,,,,,,"{'type': None, 'hours': None, 'phone': None}",,loftinbedell.com,29,28,2,4860,264,25932,,
business acquisition attorney near me,Carlsbad,business law Long tail -- Carlsbad.xlsx,1,Carlsbad Small Business Law Firm | Buying and Selling a Business ...,https://www.loftinbedell.com/corporate-business-law/small-business/,"Contact a Loftin | Bedell, P.C., attorney about corporate securities laws today; call 866-933-2340 or 760-814-9649. Buying and Selling a Business in and Around ...",,,,,,,"{'type': None, 'hours': None, 'phone': None}",,loftinbedell.com,29,28,2,4860,264,25932,,
business acquisition lawyer near me,Carlsbad,business law Long tail -- Carlsbad.xlsx,1,Carlsbad Small Business Law Firm | Buying and Selling a Business ...,https://www.loftinbedell.com/corporate-business-law/small-business/,Our experienced business transaction attorneys help prepare your entity for sale and participate in the negotiation and drafting of sale agreements.,,,,,,,"{'type': None, 'hours': None, 'phone': None}",,loftinbedell.com,29,28,2,4860,264,25932,,
business acquisition lawyer near me,Carlsbad,business law Long tail -- Carlsbad.xlsx,3,"Mergers & Acquisitions Attorney in Carlsbad and La Jolla, California",https://www.businessattorney-carlsbad.com/practice-areas/mergers-acquisitions/,"I offer highly skilled legal counsel to businesses seeking to acquire or merge with another company, combined with practical knowledge and experience.",,,,,,,,,businessattorney-carlsbad.com,18,25,1,578,83,755,,
business dispute attorney near me,Carlsbad,business law Long tail -- Carlsbad.xlsx,2,Carlsbad Law Group: Home,https://carlsbadlawgroup.com/,Our Business Litigation attorneys are highly skilled and adept at addressing the specific legal needs of our clients within diverse business ...,,,,,,,,,carlsbadlawgroup.com,8,24,1,67,37,67,,
business litigation attorney carlsbad,Carlsbad,business law Long tail -- Carlsbad.xlsx,1,Carlsbad Law Group: Home,https://carlsbadlawgroup.com/,"Carlsbad Law Group, LLP specializes in General Civil Litigation, with its team of experienced litigation attorneys successfully handling a wide ...",,,,,,,"{'type': None, 'hours': None, 'phone': None}",,carlsbadlawgroup.com,8,24,1,67,37,67,,
business litigation attorney carlsbad,Carlsbad,business law Long tail -- Carlsbad.xlsx,3,"Business Disputes & Litigation - Dillon, Miller, Ahuja, & Boss LLP",https://dmablaw.com/civil-litigation-disputes/business-disputes-litigation/,"To schedule a consultation with one or more of our business law attorneys in Carlsbad, call (858) 587-1800 or inquire online. We represent business owners ...",,,,,,,,,dmablaw.com,19,25,1,624,109,8929,,
business litigation attorney near me,Carlsbad,business law Long tail -- Carlsbad.xlsx,2,Carlsbad Law Group: Home,https://carlsbadlawgroup.com/,Our Business Litigation attorneys are highly skilled and adept at addressing the specific legal needs of our clients within diverse business ...,,,,,,,,,carlsbadlawgroup.com,8,24,1,67,37,67,,
business litigation attorney near me,Carlsbad,business law Long tail -- Carlsbad.xlsx,3,"Carlsbad Business Attorney | Law Offices of Robert L. Hill, APC",https://rlhfirm.com/index.html,"If you need legal counsel for a business matter or personal injury, call Robert Hill. Rob mediates, arbitrates, and handles appeals in these fields of law.",,,,,,,,,rlhfirm.com,7,27,37,252,84,2137,,
carlsbad breach of contract attorney,Carlsbad,business law Long tail -- Carlsbad.xlsx,1,Carlsbad Law Group: Home,https://carlsbadlawgroup.com/,"Our attorneys understand the complexities of real estate transactions, including breach of purchase and sale contracts, boundary line ...",,,,,,,"{'type': None, 'hours': None, 'phone': None}",,carlsbadlawgroup.com,8,24,1,67,37,67,,
carlsbad breach of contract attorney,Carlsbad,business law Long tail -- Carlsbad.xlsx,2,Carlsbad Civil Litigation Attorney | Partnership Dispute Lawyers,https://www.loftinbedell.com/dispute-resolution-and-litigation/,"Contact our Carlsbad, California, office at 866-933-2340 or 760-814-9649. Civil Litigation May Be Your Best Option. Sometimes, business transactions go bad.",,,,,,,,,loftinbedell.com,29,28,2,4860,264,25932,,
commercial litigation attorney carlsbad,Carlsbad,business law Long tail -- Carlsbad.xlsx,2,Carlsbad Law Group: Home,https://carlsbadlawgroup.com/,"Carlsbad Law Group, LLP is a full-service business and litigation firm committed to serving companies and individuals in matters large and small ...",,,,,,,,,carlsbadlawgroup.com,8,24,1,67,37,67,,
commercial litigation attorney carlsbad,Carlsbad,business law Long tail -- Carlsbad.xlsx,3,DMAB | San Diego Law Firm,https://dmablaw.com/,"We have extensive experience assisting clients with business and commercial matters, real estate, title insurance, technology and civil litigation.",,,,,,,,,dmablaw.com,19,25,1,624,109,8929,,
commercial litigation attorney in carlsbad,Carlsbad,business law Long tail -- Carlsbad.xlsx,2,Carlsbad Law Group: Home,https://carlsbadlawgroup.com/,"Carlsbad Law Group, LLP is a full-service business and litigation firm committed to serving companies and individuals in matters large and small ...",,,,,,,,,carlsbadlawgroup.com,8,24,1,67,37,67,,
commercial litigation attorney in carlsbad,Carlsbad,business law Long tail -- Carlsbad.xlsx,3,DMAB | San Diego Law Firm,https://dmablaw.com/,"We have extensive experience assisting clients with business and commercial matters, real estate, title insurance, technology and civil litigation.",,,,,,,,,dmablaw.com,19,25,1,624,109,8929,,
business litigation lawyer near me,Carlsbad,business law Long tail -- Carlsbad.xlsx,2,Carlsbad Law Group: Home,https://carlsbadlawgroup.com/,Our Business Litigation attorneys are highly skilled and adept at addressing the specific legal needs of our clients within diverse business ...,,,,,,,,,carlsbadlawgroup.com,8,24,1,67,37,67,,
business litigation lawyer near me,Carlsbad,business law Long tail -- Carlsbad.xlsx,3,"Carlsbad Business Attorney | Law Offices of Robert L. Hill, APC",https://rlhfirm.com/index.html,"If you need legal counsel for a business matter or personal injury, call Robert Hill. Rob mediates, arbitrates, and handles appeals in these fields of law.",,,,,,,,,rlhfirm.com,7,27,37,252,84,2137,,
clean energy and environmental law attorney near me,Carlsbad,EnvironmentalLaw-LongTail-- Carlsbad.xlsx,2,Environment & Land Use Attorney | Entitlements - Nossaman LLP,https://www.nossaman.com/practices-Environment_Land_Use,"Our environment and land use attorney provides tailored counsel on endangered species, energy and renewables, natural resources and land use.",,,,,,,,,nossaman.com,43,41,30,297411,1516,648990,,
commercial litigation attorney near me,Carlsbad,business law Long tail -- Carlsbad.xlsx,2,Carlsbad Law Group: Home,https://carlsbadlawgroup.com/,Our Business Litigation attorneys are highly skilled and adept at addressing the specific legal needs of our clients within diverse business ...,,,,,,,,,carlsbadlawgroup.com,8,24,1,67,37,67,,
commercial litigation attorney near me,Carlsbad,business law Long tail -- Carlsbad.xlsx,3,"Carlsbad Business Attorney | Law Offices of Robert L. Hill, APC",https://rlhfirm.com/index.html,"If you need legal counsel for a business matter or personal injury, call Robert Hill. Rob mediates, arbitrates, and handles appeals in these fields of law.",,,,,,,,,rlhfirm.com,7,27,37,252,84,2137,,
litigation attorney carlsbad,Carlsbad,business law Long tail -- Carlsbad.xlsx,2,Carlsbad Law Group: Home,https://carlsbadlawgroup.com/,Our firm has extensive expertise in a wide variety of civil litigation matters and dispute resolution in both state and federal courts. Our ...,,,,,,,,,carlsbadlawgroup.com,8,24,1,67,37,67,,
litigation attorney carlsbad,Carlsbad,business law Long tail -- Carlsbad.xlsx,3,"Carlsbad Civil Litigation Attorney | Estate Planning, Real Estate ...",https://www.loftinbedell.com/,"For skilled and experienced legal representation, contact the Carlsbad civil litigation attorneys at Loftin | Bedell P.C. Call us today at 760.814.9649.",,,,,,,,,loftinbedell.com,29,28,2,4860,264,25932,,
mergers and acquisitions attorney near me,Carlsbad,business law Long tail -- Carlsbad.xlsx,2,"Mergers & Acquisitions Attorney in Carlsbad and La Jolla, California",https://www.businessattorney-carlsbad.com/practice-areas/mergers-acquisitions/,"With free initial consultations and a commitment to timely, effective service, the Law Offices of Gretchen Cowen is a premier mergers and acquisitions law firm ...",,,,,,,,,businessattorney-carlsbad.com,18,25,1,578,83,755,,
air pollution legal experts near me,Carlsbad,EnvironmentalLaw-LongTail-- Carlsbad.xlsx,1,Environmental Litigation Lawyer In Carlsbad California,https://jp3law.com/carlsbad/environmental-litigation/,"Expert Environmental Litigation Lawyer in Carlsbad, CA. Trust John L. Pittman III for your legal needs. Contact us at 833-773-9889 today.",,,,,,,"{'type': None, 'hours': None, 'phone': None}",,jp3law.com,8,18,1,5064,17,1285401,,
environmental compliance attorney near me,Carlsbad,EnvironmentalLaw-LongTail-- Carlsbad.xlsx,3,Environment & Land Use Attorney | Entitlements - Nossaman LLP,https://www.nossaman.com/practices-Environment_Land_Use,"Our environment and land use attorney provides tailored counsel on endangered species, energy and renewables, natural resources and land use.",,,,,,,,,nossaman.com,43,41,30,297411,1516,648990,,
environmental impact assessment lawyers in my city,Carlsbad,EnvironmentalLaw-LongTail-- Carlsbad.xlsx,3,Environment & Land Use Attorney | Entitlements - Nossaman LLP,https://www.nossaman.com/practices-Environment_Land_Use,"Our environment and land use attorney provides tailored counsel on endangered species, energy and renewables, natural resources and land use.",,,,,,,,,nossaman.com,43,41,30,297411,1516,648990,,
environmental litigation law firm near me,Carlsbad,EnvironmentalLaw-LongTail-- Carlsbad.xlsx,3,Carlsbad Law Group: Home,https://carlsbadlawgroup.com/,"Carlsbad Law Group, LLP is a full-service law firm providing superior legal services for clients throughout California and nationwide.",,,,,,,,,carlsbadlawgroup.com,8,24,1,67,37,67,,
industrial waste and environmental law attorneys nearby,Carlsbad,EnvironmentalLaw-LongTail-- Carlsbad.xlsx,3,Environment & Land Use Attorney | Entitlements - Nossaman LLP,https://www.nossaman.com/practices-Environment_Land_Use,"Our environment and land use attorney provides tailored counsel on endangered species, energy and renewables, natural resources and land use.",,,,,,,,,nossaman.com,43,41,30,297411,1516,648990,,
legal experts in environmental policy and regulations near me,Carlsbad,EnvironmentalLaw-LongTail-- Carlsbad.xlsx,3,Environment & Land Use Attorney | Entitlements - Nossaman LLP,https://www.nossaman.com/practices-Environment_Land_Use,"Our environment and land use attorney provides tailored counsel on endangered species, energy and renewables, natural resources and land use.",,,,,,,,,nossaman.com,43,41,30,297411,1516,648990,,
local environmental attorneys for property contamination cases,Carlsbad,EnvironmentalLaw-LongTail-- Carlsbad.xlsx,1,Environmental Litigation Lawyer In Carlsbad California,https://jp3law.com/carlsbad/environmental-litigation/,"Expert Environmental Litigation Lawyer in Carlsbad, CA. Trust John L. Pittman III for your legal needs. Contact us at 833-773-9889 today.",,,,,,,"{'type': None, 'hours': None, 'phone': None}",,jp3law.com,8,18,1,5064,17,1285401,,
local environmental attorneys for property contamination cases,Carlsbad,EnvironmentalLaw-LongTail-- Carlsbad.xlsx,2,Environmental Litigation | Singleton Schreiber - Singleton Schreiber,https://www.singletonschreiber.com/practices/environmental-litigation,"Singleton Schreiber lawyers have litigated some of the country's largest wildfire, mudslide, water contamination, and other environmental litigation ...",,,,,,,,,singletonschreiber.com,38,37,37,7836,802,90441,,
local environmental lawyers specializing in pollution cases,Carlsbad,EnvironmentalLaw-LongTail-- Carlsbad.xlsx,3,San Diego Environmental Counsel | Tropea McMillan LLP,https://www.tropeamcmillan.com/san-diego-environmental-counsel/,"We conduct and defend litigation involving toxic tort and pollution issues, representing our clients' interests in court when necessary. Our attorneys have a ...",,,,,,,,,tropeamcmillan.com,25,19,2,41389,117,41421,,
water contamination lawsuit attorney near me,Carlsbad,EnvironmentalLaw-LongTail-- Carlsbad.xlsx,1,Mass Tort Attorneys | Jurewitz Law Group,https://www.jurewitz.com/mass-torts/,"Explore your legal options with our mass tort attorneys. Get comprehensive support for your mass tort case, starting with a no-cost consultation.",,,,,,,"{'type': None, 'hours': None, 'phone': None}",,jurewitz.com,33,41,1,19042,1608,130679,,
carlsbad california real estate lawyers,Carlsbad,RealEstateLaw-LongTail -- Carlsbad.xlsx,2,"Real Estate Law - Carlsbad, San Marcos, Oceanside, CA",https://bmbr.com/practice-areas/real-estate-law/,"The business and real estate attorneys at Branfman Mayfield Bustarde ... 2011 Palomar Airport Rd. Suite 306. Carlsbad, CA 92011 · (858) 793-8090 · info@bmbr ...",,,,,,,,,bmbr.com,25,28,16,6215,147,7628,,
commercial lease attorney near me,Carlsbad,RealEstateLaw-LongTail -- Carlsbad.xlsx,1,Encinitas Commercial Leases Attorney | Carlsbad Real Estate Lawyer,https://www.rrrlaw.net/commercial-leases/,"I'm attorney Richard Rice, and with 30 years of experience in real estate law, business formation and litigation, and commercial lease transactions and ...",,,,,,,"{'type': None, 'hours': None, 'phone': None}",,rrrlaw.net,9,21,4,182,40,2487,,
commercial lease attorney near me,Carlsbad,RealEstateLaw-LongTail -- Carlsbad.xlsx,2,"Carlsbad Commercial Real Estate Attorneys - Loftin | Bedell, P.C.",https://www.loftinbedell.com/real-estate/commercial-real-estate/,"Loftin | Bedell, P.C., protects your interests in commercial real estate transactions. Call a Carlsbad commercial real estate attorney at 866-933-2340 or ...",,,,,,,,,loftinbedell.com,29,28,2,4860,264,25932,,
commercial lease attorney near me,Carlsbad,RealEstateLaw-LongTail -- Carlsbad.xlsx,3,"Commercial Leases - Dillon, Miller, Ahuja, & Boss LLP",https://dmablaw.com/real-estate-law/commercial-leases/,"To schedule a consultation with a San Diego real estate lawyer from Dillon Miller Ahuja & Boss, LLP, in Carlsbad, call (858) 587-1800 or send an email inquiry.",,,,,,,,,dmablaw.com,19,25,1,624,109,8929,,
commercial real estate attorney near me,Carlsbad,RealEstateLaw-LongTail -- Carlsbad.xlsx,1,"Carlsbad Commercial Real Estate Attorneys - Loftin | Bedell, P.C.",https://www.loftinbedell.com/real-estate/commercial-real-estate/,"Loftin | Bedell, P.C., protects your interests in commercial real estate transactions. Call a Carlsbad commercial real estate attorney at 866-933-2340 or ...",,,,,,,"{'type': None, 'hours': None, 'phone': None}",,loftinbedell.com,29,28,2,4860,264,25932,,
commercial real estate attorney near me,Carlsbad,RealEstateLaw-LongTail -- Carlsbad.xlsx,3,"DMAB Real Estate Attorney - Dillon, Miller, Ahuja, & Boss LLP",https://dmablaw.com/real-estate-law/,We're real estate attorneys with extensive experience helping clients across Carlsbad and throughout California deal with all real estate law matters.,,,,,,,,,dmablaw.com,19,25,1,624,109,8929,,
commercial lease lawyer near me,Carlsbad,RealEstateLaw-LongTail -- Carlsbad.xlsx,1,"Commercial Leases - Dillon, Miller, Ahuja, & Boss LLP",https://dmablaw.com/real-estate-law/commercial-leases/,"Our attorneys can help you determine what is right for you. To schedule a consultation with a San Diego real estate lawyer from Dillon Miller Ahuja & Boss, LLP , in Carlsbad, call (858) 587-1800 or send an email inquiry.",,,,,,,"{'type': None, 'hours': None, 'phone': None}",,dmablaw.com,19,25,1,624,109,8929,,
commercial lease lawyer near me,Carlsbad,RealEstateLaw-LongTail -- Carlsbad.xlsx,2,Encinitas Commercial Leases Attorney | Carlsbad Real Estate Lawyer,https://www.rrrlaw.net/commercial-leases/,"I'm attorney Richard Rice, and with 30 years of experience in real estate law, business formation and litigation, and commercial lease transactions and ...",,,,,,,,,rrrlaw.net,9,21,4,182,40,2487,,
commercial lease lawyer near me,Carlsbad,RealEstateLaw-LongTail -- Carlsbad.xlsx,3,"Carlsbad Commercial Real Estate Attorneys - Loftin | Bedell, P.C.",https://www.loftinbedell.com/real-estate/commercial-real-estate/,"Loftin | Bedell, P.C., protects your interests in commercial real estate transactions. Call a Carlsbad commercial real estate attorney at 866-933-2340 or ...",,,,,,,,,loftinbedell.com,29,28,2,4860,264,25932,,
commercial real estate lawyer near me,Carlsbad,RealEstateLaw-LongTail -- Carlsbad.xlsx,2,"Carlsbad Commercial Real Estate Attorneys - Loftin | Bedell, P.C.",https://www.loftinbedell.com/real-estate/commercial-real-estate/,"Loftin | Bedell, P.C., protects your interests in commercial real estate transactions. Call a Carlsbad commercial real estate attorney at 866-933-2340 or ...",,,,,,,,,loftinbedell.com,29,28,2,4860,264,25932,,
commercial real estate lawyer near me,Carlsbad,RealEstateLaw-LongTail -- Carlsbad.xlsx,3,"DMAB Real Estate Attorney - Dillon, Miller, Ahuja, & Boss LLP",https://dmablaw.com/real-estate-law/,We're real estate attorneys with extensive experience helping clients across Carlsbad and throughout California deal with all real estate law matters.,,,,,,,,,dmablaw.com,19,25,1,624,109,8929,,
hoa attorney representing homeowners,Carlsbad,RealEstateLaw-LongTail -- Carlsbad.xlsx,3,Homeowners Association (HOA) Lawyer l Wakefield Law Firm,https://wakefieldlawfirm.com/hoa-law/,I have a niche practice representing homeowners in disputes with HOAs. I work with homeowners all over Southern California. I'm here to help you!,,,,,,,,,wakefieldlawfirm.com,16,25,1,4629,103,7089,,
homeowners association attorney near me,Carlsbad,RealEstateLaw-LongTail -- Carlsbad.xlsx,3,"Delphi Law Group, LLP – Experience. Integrity. Vision.",https://delphillp.com/,"Delphi Law Group is a full-service law firm serving clients in the field of community association law. ... Carlsbad, CA 92008 74-900 Highway 111, Suite 222",,,,,,,,,delphillp.com,19,29,3,2714,141,3132,,
property dispute lawyers near me,Carlsbad,RealEstateLaw-LongTail -- Carlsbad.xlsx,1,Carlsbad Property Division Lawyer - Expert Advice - Erica Bloom Law,https://www.ericabloomlaw.com/carlsbad-property-division-lawyer/,Carlsbad Property Division Attorney  Call Erica Bloom Law today at (760) 683-8757 or contact us online to schedule a meeting with our property division attorney in Carlsbad!,,,,,,,"{'type': None, 'hours': None, 'phone': None}",,ericabloomlaw.com,15,25,2,174,60,18045,,
property dispute lawyers near me,Carlsbad,RealEstateLaw-LongTail -- Carlsbad.xlsx,2,"Carlsbad Civil Litigation Attorney | Estate Planning, Real Estate ...",https://www.loftinbedell.com/,"For skilled and experienced legal representation, contact the Carlsbad civil litigation attorneys at Loftin | Bedell P.C. Call us today at 760.814.9649.",,,,,,,,,loftinbedell.com,29,28,2,4860,264,25932,,
real estate attorney carlsbad,Carlsbad,RealEstateLaw-LongTail -- Carlsbad.xlsx,1,"Real Estate Law - Carlsbad, San Marcos, Oceanside, CA",https://bmbr.com/practice-areas/real-estate-law/,"The business and real estate attorneys at Branfman Mayfield Bustarde ... 2011 Palomar Airport Rd. Suite 306. Carlsbad, CA 92011 · (858) 793-8090 · info@bmbr ...",,,,,,,"{'type': None, 'hours': None, 'phone': None}",,bmbr.com,25,28,16,6215,147,7628,,
real estate attorney carlsbad,Carlsbad,RealEstateLaw-LongTail -- Carlsbad.xlsx,3,"Carlsbad Civil Litigation Attorney | Estate Planning, Real Estate ...",https://www.loftinbedell.com/,"For skilled and experienced legal representation, contact the Carlsbad civil litigation attorneys at Loftin | Bedell P.C. Call us today at 760.814.9649.",,,,,,,,,loftinbedell.com,29,28,2,4860,264,25932,,
real estate attorneycarlsbad,Carlsbad,RealEstateLaw-LongTail -- Carlsbad.xlsx,2,"Real Estate Law - Carlsbad, San Marcos, Oceanside, CA",https://bmbr.com/practice-areas/real-estate-law/,"The business and real estate attorneys at Branfman Mayfield Bustarde ... 2011 Palomar Airport Rd. Suite 306. Carlsbad, CA 92011 · (858) 793-8090 · info@bmbr ...",,,,,,,,,bmbr.com,25,28,16,6215,147,7628,,
real estate attorneycarlsbad,Carlsbad,RealEstateLaw-LongTail -- Carlsbad.xlsx,3,"Carlsbad Civil Litigation Attorney | Estate Planning, Real Estate ...",https://www.loftinbedell.com/,"For skilled and experienced legal representation, contact the Carlsbad civil litigation attorneys at Loftin | Bedell P.C. Call us today at 760.814.9649.",,,,,,,,,loftinbedell.com,29,28,2,4860,264,25932,,
real estate closing attorney near me,Carlsbad,RealEstateLaw-LongTail -- Carlsbad.xlsx,3,"Real Estate Law - Carlsbad, San Marcos, Oceanside, CA",https://bmbr.com/practice-areas/real-estate-law/,"The business and real estate attorneys at Branfman Mayfield Bustarde ... 2011 Palomar Airport Rd. Suite 306. Carlsbad, CA 92011 · (858) 793-8090 · info@bmbr ...",,,,,,,,,bmbr.com,25,28,16,6215,147,7628,,
real estate lawyers in carlsbad,Carlsbad,RealEstateLaw-LongTail -- Carlsbad.xlsx,2,"Real Estate Law - Carlsbad, San Marcos, Oceanside, CA",https://bmbr.com/practice-areas/real-estate-law/,"The business and real estate attorneys at Branfman Mayfield Bustarde ... 2011 Palomar Airport Rd. Suite 306. Carlsbad, CA 92011 · (858) 793-8090 · info@bmbr ...",,,,,,,,,bmbr.com,25,28,16,6215,147,7628,,
real estate lawyers in carlsbad,Carlsbad,RealEstateLaw-LongTail -- Carlsbad.xlsx,3,"Carlsbad Civil Litigation Attorney | Estate Planning, Real Estate ...",https://www.loftinbedell.com/,"For skilled and experienced legal representation, contact the Carlsbad civil litigation attorneys at Loftin | Bedell P.C. Call us today at 760.814.9649.",,,,,,,,,loftinbedell.com,29,28,2,4860,264,25932,,
real estate litigation attorney near me,Carlsbad,RealEstateLaw-LongTail -- Carlsbad.xlsx,2,"Carlsbad Civil Litigation Attorney | Estate Planning, Real Estate ...",https://www.loftinbedell.com/,"For skilled and experienced legal representation, contact the Carlsbad civil litigation attorneys at Loftin | Bedell P.C. Call us today at 760.814.9649.",,,,,,,,,loftinbedell.com,29,28,2,4860,264,25932,,
